{
    "contractName": "smart-parking.simulation-snapshot",
    "schemaVersion": "1.1",
    "snapshotType": "simulation_snapshot",
    "snapshotId": "scenario-concert-rain-unity-session-20260801T054002874Z-run-0001-snapshot-00000002",
    "sourceSystem": "unity",
    "generatedAtUtc": "2026-08-01T05:41:03.7685036+00:00",
    "sceneName": "SampleScene",
    "sessionId": "unity-session-20260801T054002874Z",
    "runId": "unity-session-20260801T054002874Z-run-0001",
    "sequenceNumber": 2,
    "scenario": {
        "scenarioId": "scenario-concert-rain",
        "scenarioVersion": "p1-local-2",
        "scenarioName": "P1 Local External Factors",
        "facilityId": "facility-main",
        "mapVersion": "2026-07-16",
        "timeOfDay": "daytime",
        "randomSeed": 12345,
        "randomSeedPolicy": "fixed_per_repetition",
        "simulationTimeSeconds": 60.008,
        "durationSeconds": 14400.0,
        "isCompleted": false
    },
    "runtime": {
        "arrivalRateSourceId": "default",
        "arrivalDistribution": "fixed",
        "baseVehiclesPerMinute": 12.0,
        "arrivalRateMultiplier": 1.0,
        "effectiveVehiclesPerMinute": 12.0,
        "vehicleSpeedMultiplier": 1.0,
        "activeVehicleCount": 11,
        "discoveredVehicleCount": 11,
        "maxConcurrentVehicles": 60,
        "totalSpawnedCount": 11
    },
    "summary": {
        "totalSlotCount": 240,
        "availableSlotCount": 231,
        "emptySlotCount": 231,
        "reservedSlotCount": 5,
        "occupiedSlotCount": 3,
        "leavingSlotCount": 1,
        "disabledSlotCount": 0,
        "areaCount": 4,
        "accessPointCount": 2,
        "vehicleCount": 11,
        "activeScenarioFactorCount": 1
    },
    "activeScenarioFactors": [
        {
            "scenarioFactorId": "factor-extreme-heat",
            "factorCode": "extreme_heat",
            "label": "猛暑",
            "category": "Temperature",
            "informationAvailability": "Forecasted",
            "intensity": 1.0,
            "startSimulationTimeSeconds": 0.0,
            "endSimulationTimeSeconds": 14400.0,
            "hasKnownFromSimulationTimeSeconds": true,
            "knownFromSimulationTimeSeconds": 0.0,
            "effects": [
                {
                    "scenarioFactorEffectId": "effect-extreme-heat-area-a",
                    "targetType": "Area",
                    "targetId": "area-a",
                    "resolvedTargetId": "area-a",
                    "metric": "parking_preference_weight",
                    "operation": "Multiply",
                    "value": 1.25,
                    "unit": "ratio"
                },
                {
                    "scenarioFactorEffectId": "effect-extreme-heat-area-b",
                    "targetType": "Area",
                    "targetId": "area-b",
                    "resolvedTargetId": "area-b",
                    "metric": "parking_preference_weight",
                    "operation": "Multiply",
                    "value": 1.25,
                    "unit": "ratio"
                },
                {
                    "scenarioFactorEffectId": "effect-extreme-heat-area-d",
                    "targetType": "Area",
                    "targetId": "area-d",
                    "resolvedTargetId": "area-d",
                    "metric": "parking_preference_weight",
                    "operation": "Multiply",
                    "value": 1.25,
                    "unit": "ratio"
                },
                {
                    "scenarioFactorEffectId": "effect-extreme-heat-main-entrance",
                    "targetType": "AccessPoint",
                    "targetId": "entrance-main",
                    "resolvedTargetId": "entrance-south",
                    "metric": "parking_preference_weight",
                    "operation": "Multiply",
                    "value": 1.6,
                    "unit": "ratio"
                }
            ]
        }
    ],
    "accessPoints": [
        {
            "accessPointId": "entrance-south",
            "scenePairName": "south_gate",
            "entranceWaypointId": "Entrance_south",
            "exitWaypointId": "Exit_south",
            "currentPreferenceWeight": 1.6,
            "spawnPosition": {
                "x": -5.0,
                "y": 0.02,
                "z": -117.5
            }
        },
        {
            "accessPointId": "entrance-west",
            "scenePairName": "west_gate",
            "entranceWaypointId": "Entrance_west",
            "exitWaypointId": "Exit_west",
            "currentPreferenceWeight": 1.0,
            "spawnPosition": {
                "x": -152.5,
                "y": 0.02,
                "z": 5.0
            }
        }
    ],
    "areas": [
        {
            "areaId": "area-a",
            "sceneAreaId": "A",
            "totalSlotCount": 60,
            "availableSlotCount": 57,
            "emptySlotCount": 57,
            "reservedSlotCount": 1,
            "occupiedSlotCount": 1,
            "leavingSlotCount": 1,
            "disabledSlotCount": 0,
            "currentPreferenceWeight": 1.25
        },
        {
            "areaId": "area-b",
            "sceneAreaId": "B",
            "totalSlotCount": 60,
            "availableSlotCount": 57,
            "emptySlotCount": 57,
            "reservedSlotCount": 3,
            "occupiedSlotCount": 0,
            "leavingSlotCount": 0,
            "disabledSlotCount": 0,
            "currentPreferenceWeight": 1.25
        },
        {
            "areaId": "area-c",
            "sceneAreaId": "C",
            "totalSlotCount": 60,
            "availableSlotCount": 58,
            "emptySlotCount": 58,
            "reservedSlotCount": 1,
            "occupiedSlotCount": 1,
            "leavingSlotCount": 0,
            "disabledSlotCount": 0,
            "currentPreferenceWeight": 1.0
        },
        {
            "areaId": "area-d",
            "sceneAreaId": "D",
            "totalSlotCount": 60,
            "availableSlotCount": 59,
            "emptySlotCount": 59,
            "reservedSlotCount": 0,
            "occupiedSlotCount": 1,
            "leavingSlotCount": 0,
            "disabledSlotCount": 0,
            "currentPreferenceWeight": 1.25
        }
    ],
    "parkingSlots": [
        {
            "slotId": "A-01",
            "areaId": "area-a",
            "sceneAreaId": "A",
            "state": "Empty",
            "isAvailable": true,
            "sensorOccupied": false,
            "isLeaving": false,
            "reservedByVehicleId": "",
            "occupiedByVehicleId": "",
            "accessWaypointId": "WP_Slot_A_01",
            "position": {
                "x": -119.0,
                "y": 0.0,
                "z": -86.0
            },
            "parkingPointPosition": {
                "x": -119.0,
                "y": 1.0,
                "z": -86.0
            }
        },
        {
            "slotId": "A-02",
            "areaId": "area-a",
            "sceneAreaId": "A",
            "state": "Empty",
            "isAvailable": true,
            "sensorOccupied": false,
            "isLeaving": false,
            "reservedByVehicleId": "",
            "occupiedByVehicleId": "",
            "accessWaypointId": "WP_Slot_A_02",
            "position": {
                "x": -119.0,
                "y": 0.0,
                "z": -78.0
            },
            "parkingPointPosition": {
                "x": -119.0,
                "y": 1.0,
                "z": -78.0
            }
        },
        {
            "slotId": "A-03",
            "areaId": "area-a",
            "sceneAreaId": "A",
            "state": "Empty",
            "isAvailable": true,
            "sensorOccupied": false,
            "isLeaving": false,
            "reservedByVehicleId": "",
            "occupiedByVehicleId": "",
            "accessWaypointId": "WP_Slot_A_03",
            "position": {
                "x": -119.0,
                "y": 0.0,
                "z": -70.0
            },
            "parkingPointPosition": {
                "x": -119.0,
                "y": 1.0,
                "z": -70.0
            }
        },
        {
            "slotId": "A-04",
            "areaId": "area-a",
            "sceneAreaId": "A",
            "state": "Empty",
            "isAvailable": true,
            "sensorOccupied": false,
            "isLeaving": false,
            "reservedByVehicleId": "",
            "occupiedByVehicleId": "",
            "accessWaypointId": "WP_Slot_A_04",
            "position": {
                "x": -119.0,
                "y": 0.0,
                "z": -62.0
            },
            "parkingPointPosition": {
                "x": -119.0,
                "y": 1.0,
                "z": -62.0
            }
        },
        {
            "slotId": "A-05",
            "areaId": "area-a",
            "sceneAreaId": "A",
            "state": "Empty",
            "isAvailable": true,
            "sensorOccupied": false,
            "isLeaving": false,
            "reservedByVehicleId": "",
            "occupiedByVehicleId": "",
            "accessWaypointId": "WP_Slot_A_05",
            "position": {
                "x": -119.0,
                "y": 0.0,
                "z": -54.0
            },
            "parkingPointPosition": {
                "x": -119.0,
                "y": 1.0,
                "z": -54.0
            }
        },
        {
            "slotId": "A-06",
            "areaId": "area-a",
            "sceneAreaId": "A",
            "state": "Empty",
            "isAvailable": true,
            "sensorOccupied": false,
            "isLeaving": false,
            "reservedByVehicleId": "",
            "occupiedByVehicleId": "",
            "accessWaypointId": "WP_Slot_A_06",
            "position": {
                "x": -119.0,
                "y": 0.0,
                "z": -46.0
            },
            "parkingPointPosition": {